82ece8aa-d20c-d375-a5d4-53c4a845fee9,"Democrat, Joe Biden",someone who listens to the people,a good leader,I honestly do not know.,Somewhat important,I want a candidate that will actually listen to my concerns.
b7ed70cf-f111-be9e-8545-b11f6d820335,"Democrat, Joe Biden",Someone who isn't a misogynistic liar,The fact the Trump is an idiot,Meh,Somewhat important,Women's rights
3a9048cc-d063-d3e7-ec7e-f0abe1a29ffa,"Republican, Donald Trump",Strength,Immigration,Fear,I am not planning to vote in 2022,Immigration
9347f486-2a44-da88-17f8-5f5bf1e2cce7,"Democrat, Joe Biden",Christian beliefs,Handling of Covid,Uncertainty,Somewhat important,Health issues
ceefd2c9-7e2b-73ce-edf9-8b8d8ddd6a3e,"Libertarian, Jo Jorgenson",They weren't seeking to create more regulation and tax us more.,Taxes and Healthcare for the working class.,I haven't heard any of them say anything intelligent whatsoever. None of them even attempt to solve anything other than by throwing taxpayer money at it and hoping it goes away.,Not very important,Healthcare and housing. At this rate all of our kids will live in tents outside of empty houses because nobody can afford them anymore.
ad411244-ff79-f0f4-af64-257283d7cafc,"Democrat, Joe Biden",CARES FOR THE PEOPLE,UMEMPLOYMENT,I DON'T VOTE USUALLY MIDTERM,Somewhat important,GETTING RID OF TRUMP'S PEOPLE
fe85544c-3e85-9c67-5855-e4a0bfea3d2a,"Democrat, Joe Biden",Past values,Education,Nervous,Somewhat important,Education
2b24ef63-f6f3-2192-72da-dc219b7cd539,"Democrat, Joe Biden",Uh i dunno i did this for creds im broke,Uh i dunno i did this for creds im broke,I dunno i just dont like them white girls who live in trailer,Very important,Nope nvm i promise i was playinn
22212e52-d6e3-8103-5df7-0cc1133b385e,"Democrat, Joe Biden",Honesty and sincerity,I felt that Biden was honest,Hopeful,Very important,Seniors
00926d61-368b-7d68-43c6-b5324b25c483,"Democrat, Joe Biden",Support for immigration reform and abortion access,Immigration and abortion access,committed,Very important,Immigration
ae864837-ccc1-0250-7edd-84838cd4e7bc,"Republican, Donald Trump",I don't know.,I don't know.,I don't know.,Not very important,Mark.
c0476d80-532b-d70a-209f-839fb6ddbd11,"Republican, Donald Trump",Someone who cares about the people,Economy,Indifferent,Not at all important,If my vote will even be counted
bdecb67a-ec6e-8294-b9da-c7798079cdc9,"Democrat, Joe Biden",Anyone but Trump,The riot at the capital,Nervous,Somewhat important,Voting for the right candidate
15263fef-7c65-dbfb-483f-ca724a1a7c2e,"Libertarian, Jo Jorgenson",Honesty,They both are liars,Scared,Not very important,None
615eca80-0d0b-6920-dd46-0c9117478b5c,"Republican, Donald Trump",Honesty,Economy,Anxious,Not very important,The economy
b33d9c7c-4e73-3dcc-8664-82ee6844a0e3,"Republican, Donald Trump",Good leadership traits as well as being smart,Stimulus,Boring,Not at all important,Nithing
0d394b57-a4d4-df15-6d54-a50182866d40,"Republican, Donald Trump",Joe Biden,Joe Biden,democratic,Very important,democratic
5d13539c-44ed-4fd5-1c2c-8fb14de5f2f7,"Republican, Donald Trump",Higher wages lower employment status more education,Jobs vaccinations an education,Very skeptical,Very important,That they change change change
47b885fa-78d8-cdd6-490a-886c36442939,"Democrat, Joe Biden",Someone who's going to take the coronavirus seriously,Racial,Determined,Very important,Social justice and jobs
96c2e045-c75f-fb36-be30-cae95c83b98e,"Republican, Donald Trump",Best economy health. Most financially smart,Biden stopping oil fracking,Scared,Don't know,Rigging elections
35c0c003-d2cb-03eb-fd52-3fad3fbefe33,"Republican, Donald Trump",Who would have a strong arm against our enemies and keep our allies close,Scandals,"Worry, about possible election fraud",Very important,Who will help lead the nation/state
f8e351ea-9aeb-bc3e-a1f7-815758f34359,"Republican, Donald Trump",nothing,nothing,nothing,Very important,nothing
bb0084fa-3822-b51b-5b00-f1a0d2ed3196,"Republican, Donald Trump",The president that could get things done,The pipeline also the way that the Mexican children ate treated,I felt like the person getting in was a bad choice,Not very important,That everything would be for tye better
653d171f-c0bd-e748-dbb4-64a3cec79642,"Democrat, Joe Biden",His views are inline with mine,Senior health care,We will see in 2022,Very important,Senior health care
91d51b06-3059-1fbc-2d15-94cbdcc31cb2,"Democrat, Joe Biden",Not sure,Not sure,Not sure,Somewhat important,Not sure
4eb0c866-29c3-d598-d0c2-4f2171bf5c97,"Republican, Donald Trump",Honesty,Morality,Annoyed,Very important,Logic
3e6a41f1-278e-2f60-7a99-bd7654edfb70,"Democrat, Joe Biden",Some one that is for all people not just the rich people,Biden was for the people he help out in many ways good president,It depends who is up to run,Very important,Being for the people and not selfish
f4dafcc8-1a0b-6310-397a-4dc81c31d9b9,"Republican, Donald Trump",One whom is honest and does what he says he is going to do,Not having open borders,Excited,Very important,Immigration
5c494d63-1e4c-3fdf-556e-fce49d9e4da2,"Democrat, Joe Biden",Reputation,Jobs,Hopeful,Very important,Jobs and wages
afe9c3dc-aad2-6db6-e4a3-5a102674d1ff,"Republican, Donald Trump",no idea,who was the better president,happines,Somewhat important,important people
f1abf7a0-cd59-1b8c-2362-7835555df8c6,"Democrat, Joe Biden",school,black lives matter,okay e i forget your,Somewhat important,okay okay thanks babe
89eb56c1-7f42-1889-8ca1-7f756b2d470a,"Democrat, Joe Biden",Not trump,Lgbtq+ rights,I don't know yet,Somewhat important,LGBTQ rights
894539ec-8850-3e9d-7e1b-203488a5316f,"Democrat, Joe Biden",Trustworthy,Which would do better in global warming,Don't care,Not at all important,Nothing in gwneral
340a22d7-00bb-d543-5c98-fd573c359ce2,"Republican, Donald Trump",Honesty,Everything,Pissed,Somewhat important,I'm not sure
bf3b1681-0e4d-364e-397e-8bfbd3ec2149,"Democrat, Joe Biden",We are in the back of,We will have the next meeting,I'm going to go back to,Very important,I'm going to go
6680c5e3-363c-bc32-be3e-14022008bd4c,"Democrat, Joe Biden",Ideas and values I support,Willingness to work with and for all Americans,Determined,Very important,Voting rights
300ffa68-4f22-7efa-e8e1-3f98c1ab6398,"Republican, Donald Trump",Who is best fit,Who would handle the economy,I'm not going to,I am not planning to vote in 2022,Nothing
acb83fce-b3e1-511b-2128-04c5f94e485d,"Democrat, Joe Biden",Caring and generous and honest,His attitude,I am excited,Don't know,Womens rights
ae742530-ceb6-bfdc-3734-a78de2682c9f,"Republican, Donald Trump",Who would better service this country.,Our country as a whole.,Anxious,Very important,Our country as a whole
9bd65068-ba8d-6f8c-fe05-fcef842c49fa,"Democrat, Joe Biden",Honesty,I fucking hated trump,Excited,Somewhat important,Economic
c35d8f64-418a-f089-fa7d-e9617927a136,"Republican, Donald Trump",Competence,Abortion,Blessed,Somewhat important,Education
5d0c8205-0a22-be56-7cfe-8ab0919883f9,"Democrat, Joe Biden",TO do it doesn't matter to me what time is good morning I will be there at it and tell,Good morning mother and family are you want me what I can do it doesn't work for me to,Ight I don't know if you can come over and get it to you can come over and get it to you can come over and get it to you can come over and,Not very important,Hey you can come over and get
b32281f3-3eac-5015-ca64-25fcbdb4f711,"Democrat, Joe Biden",Honesty,Healthcare,Satisfying,Very important,Healthcare costs
366f4268-7c7d-d490-9ab7-f449ff169376,"Republican, Donald Trump",Transparency and fighting for Americans,Helping Americans,Uncertainty,Very important,Economy
7b4bcaf8-6b4a-3541-f123-167e596a2b36,"Democrat, Joe Biden",Who is capable of doing better,The entire countey,Happy,Somewhat important,Economic issues
c8aae0c8-b057-31fd-8916-f0b779ba547e,"Democrat, Joe Biden",Someone with vision,Not sure,Excitement,Very important,Not sure
32d4d3a5-98dd-6c3c-e4ce-b832c8776e4b,"Democrat, Joe Biden",Honestly,Trump wasn't a great president,Fear,Very important,Trump is an orange
4e954929-e58b-2d2d-4d4c-3b8004251c71,"Democrat, Joe Biden",Ability to function as president,Ability to function as a president,Undecided,Not very important,Similar beliefs to mine
55f8bbb8-c3dc-5b92-f95c-a96d85ee751c,"Democrat, Joe Biden",i don't know.,bro idk,don't care,Not very important,nothing
1a8a76f3-6949-9fce-eeb8-1b7d9dc33d41,"Democrat, Joe Biden",A president who was mature and didn't rant on Twitter like trump.,I wanted a president who cared about human rights.,Mixed feelings,Somewhat important,I am thinking about views of the candidates and what they want to do for this country to improve it.
da095b0c-4a37-2da3-aaef-0d3e085acd62,"Democrat, Joe Biden",not racist and strong,get Trump out of office,I just want it over already,Very important,everything
1d4ff1c8-618e-72a7-8d34-dd8374629fb5,"Democrat, Joe Biden",Who would actually make a change finally,Racism,Mixed emotions,Somewhat important,"Ending racism, creating more jobs with better pay, putting a end to discrimination and etc."
cb33478a-f7b5-b05b-59c1-d16c1fdb563a,"Republican, Donald Trump",To be honest and good with economy,Because he is excellent in all what he do,Idk,Very important,I can't vote
ac5d7133-6a2a-dcad-e8ca-5b2ecb8e2d61,"Republican, Donald Trump",The way the country was going to be ran,Economic,Anxious,Somewhat important,Economic
20572e73-cd19-9b5e-b5c4-3078197df05f,"Republican, Donald Trump",Honesty,Economic,I probably won't,I am not planning to vote in 2022,Believable campaign platform
60cb9e17-c93a-7471-ce9d-ef4ec7affa24,"Republican, Donald Trump",Could he run a country,Health care,Concerned,Somewhat important,Get this country back to what it used to be
6b7f0864-aff5-4774-35d5-f4e513893a70,"Democrat, Joe Biden",Respect,The needs of americans,Determined,Somewhat important,Not sure
293e16b3-cefd-1224-736c-c67ee886818e,"Democrat, Joe Biden",So.eone who would support the people in poverty,Education funds,Confused,Somewhat important,Poverty levels
2067902b-f099-e2b6-b10c-cf77ba4d6c8e,"Republican, Donald Trump","Economic situations, human right and my values",Values,Nothing for now,Very important,Non
34b16488-cb4a-1b4b-2a68-3e184fc40b0a,"Democrat, Joe Biden","Good values, being honest",Getting trump out of office,Eager,Very important,"Economy, money for poor"
f34bfa59-a525-23e3-e093-97d5d3a1b88a,"Democrat, Joe Biden",Humanity,Economic issues and better healthcare and treatment of American people,Hopeful,Somewhat important,Healthcare and economy
3b8ede31-e614-15dd-5251-d645cb94cf8d,"Republican, Donald Trump",Ability to get things done,Change,More motivated,Not very important,Voting for right candidate
0490eb68-48f8-2df6-0571-dd83938fdb37,"Republican, Donald Trump",Honesty,He knew how the economy was doing and headed for,I am uncertain at this time,Somewhat important,The economy upturn in spite of the Pandemic
784aee43-11c7-beb2-042a-6bd7a51004b8,"Republican, Donald Trump",let Trump finish what he started,stimulus checks,obligation,Very important,stimulus
7e4b4f10-745f-780e-fbe5-403bb24b007b,"Democrat, Joe Biden",no,terriosm,did not really follow,Very important,nothing i can figure out these days
d0ef0cd4-5e6e-e398-cff1-b675e6fb976b,"Libertarian, Jo Jorgenson",Human rights,Social issues,Exhaustion,Not at all important,Human rights
0d700c8b-de36-390a-b030-9415ef21db2c,"Democrat, Joe Biden",Nothing,Education,Nothing,Somewhat important,Nothing
db19de67-bc3a-8abb-a5aa-9765a8d3bb7d,"Republican, Donald Trump",Economy issues,Economy,Dissatisfied,Not very important,Economic
1b0c9092-8127-a8f7-d909-e0c9276c7935,"Democrat, Joe Biden",Honesty,Racial equality,Excitement,Very important,Racial equality
73d2939e-f99d-d6d5-62b5-17815d17c25d,"Democrat, Joe Biden",who would do the best for us. like help out with taxes and children creditsre,he is getting thing's done,happy,Somewhat important,helping people get back on there feet after covid
6e4c1501-808f-8cb9-659d-12db268f090a,"Democrat, Joe Biden",Good attitude respectful and provide for the country,Motion didn't even think that he was going to win but I knew he was going to make the world better,Feeling very excited hopefully he win,Very important,Doing more campaign showing love to the neighborhood
70fbb28e-0d9b-b3b5-556f-f3c182077e01,"Republican, Donald Trump",not a career politcian,the economy,anxious,Very important,the economy
307fc576-4b43-f873-31a5-80d76c2ec07e,"Republican, Donald Trump",Zee I'm Oxon e gunk,Zebulon pain g exuberant,Resubmit o can fill,Somewhat important,Edible Iain resin
84c42de1-7e5d-a21a-9b81-b89887916cbe,"Republican, Donald Trump",Someone who told the truth,Building the wall on the border of Texas in Mexico.,I haven't thought about it yet,I am not planning to vote in 2022,That is another topic that I have not yet thought about
b3133c8e-9ec6-c95e-e1f2-17be39f99c64,"Democrat, Joe Biden",It's the same thing I have to do and I don't have,It's good and he is good with,It's good to church lol it's good lol it's like it's a,Very important,Yes that's what I'm saying I think lol I don't feel bad about this one
e8646e0c-80d4-58b9-2f61-5360182047f7,"Democrat, Joe Biden",Personality,Not to be Donald trump,Exciting,Very important,Education systems
ae7303c0-50ab-3660-2b94-5cbb3d162ab9,"Democrat, Joe Biden",A democratic,Trump is insane,Frustrated,Don't know,Health care
794ceef2-f833-dfa7-5a26-15f89810b8c1,"Republican, Donald Trump","a strong and supportive individual to the usa as a whole, not secular denominations",Economy,determined,Very important,economy and education
25dccca2-054e-6210-a3c9-f400ba6c557c,"Democrat, Joe Biden","Tax, immigration","Abortion, Gun restrictions",Alright,Don't know,"Abortion, taxes, immigration"
fcc1c48c-7303-50ca-e992-6bade6335f58,"Republican, Donald Trump",Strength and policy.,The economy.,Motivated,Very important,The economy.
96d26487-641a-4b74-54c9-3d44e353a243,"Democrat, Joe Biden",Democratic candidates,Donald Trump be out of office,Neutral,Somewhat important,Environment
ed5f24c3-7fb9-ae49-0222-3c10f82f2dc3,"Republican, Donald Trump",Wyd I will try again later tonight,I just got a message to,I'm so sorry,Not very important,I can send a video
108ab4de-49cb-6790-7ca0-8cde4dbbb7cd,"Democrat, Joe Biden",Nothing I need,Nothing I need,Nothing,Somewhat important,Nothing in person
7d05955b-0d9e-1328-1f99-7c8097d38ab9,"Republican, Donald Trump",The candidate that best representing my values,Strong foreign policy,Eagerness,Very important,Taking back the Senate
8082a0ee-dbe8-1d7a-c907-03e848841707,"Democrat, Joe Biden",Fairness,Mexican boarder,Nervous,Somewhat important,Canadaites
5f843666-831f-fc00-9490-029d3e1e0693,"Democrat, Joe Biden","We need a strong, honest and transparent leader",Corruption in the Republican Party most of all,I won't gonna vote for midterms elections,Not very important,The only issue for me I'll se on doing this midterm elections it's that it's a wasted of money and time
767a92b7-0186-2029-ab8a-501567273710,"Republican, Donald Trump",Faith,Abortion,Not interested,Not very important,Social security benefits
b819b15d-4f96-8a84-a0d4-4d244d074581,"Democrat, Joe Biden",Morals and values,Unemployment,Happy,Very important,Everything
467248f6-aaee-5d68-5e09-f48e7e32e5d0,"Republican, Donald Trump",I'm not sure,I'm not sure,I'm not sure,Not at all important,I'm not sure
08b9b2e9-4d81-c859-949e-24ad02d22ee7,"Democrat, Joe Biden",I did not vote,I did not vote,I was not eligible,I am not planning to vote in 2022,None
96bf02dd-52f6-af5a-b2a0-f8512121cc4f,"Republican, Donald Trump",That a president takes care of our nation as whole and not decide the well being of just one party or the other,That he does what he says he's gonna do,Be able to vote for an honest candidate,Very important,Honest people to vote for
114c440d-675d-b93b-d473-6d379e12d7cf,"Democrat, Joe Biden",The specific quality I looked for was,Everything,Neevous,Somewhat important,The most specific issue would be
01572a56-e4ae-b85f-23fb-e8f2cf5cbd7f,"Republican, Donald Trump",Business ethics,No BS kind of man. Something we have needed for a long time.,Who cares,Somewhat important,Taxes. Reducing then
917bc866-6874-7b44-c63e-23bf5c0c309c,"Democrat, Joe Biden",Leader,I hen they had positive messages,It was confusing but I'm hoping us citizens will chose right president,Somewhat important,The changes they could do
351d1137-d518-5b72-30ac-cfda7f055b10,"Democrat, Joe Biden",Not Trump,Help the country heal,Frustrated,Very important,Nothing yet
e65664ac-9e54-a175-5b42-9d0e5a239f52,"Democrat, Joe Biden",I liked it alot,It was nice,I like it a lot really,Not at all important,Logic my like
88cfffa2-1324-97ee-49be-e3ddf7d65f6a,"Republican, Donald Trump",Courage,Courage,Watch out!!,Very important,Economy
4feeea91-8003-14a8-9c7a-b4e3ee8b09a3,"Democrat, Joe Biden",Support,Support,Support,Not very important,Support
0f344fe1-c3c5-bbb5-e355-ce1655a47eab,"Democrat, Joe Biden",Their Pass actions,The benefits,Confused,Very important,Candidates
9c291269-e781-c4cc-9058-e121f2aff86f,"Democrat, Joe Biden",The democratic candidate,Immigration,Iffy,Somewhat important,Not sure at the moment
ceb7803e-c3fc-ac0e-d5c2-c94db3fdc2b8,"Democrat, Joe Biden",If they are for the people as the majority,The issue was BLM as the previous president was not about it,Non-chalant,Somewhat important,Nothing
121d87ac-fb26-7d27-5889-55c0090d7d2f,"Democrat, Joe Biden",Hoe biden,The wall,Shocked,Not very important,The wall
1aa3c18e-0aaf-8962-b92c-23e3454009f2,"Republican, Donald Trump","A patriot, defender of the people",Honesty,"Excited, nervous",Somewhat important,International relations
39a9a8a9-81f2-5a73-7f20-f661091d1643,"Republican, Donald Trump","Someone who is direct and to the point, has a clear and concise plan.",What was most important in deciding to vote for Trump was the fact that he created many jobs for the American people and he made the economy strong and prosperous.,Anxious,Very important,Immigration
178cb5a0-3b66-8afa-3cf8-b9130ed40264,"Democrat, Joe Biden",Honesty,Covid and economy,Scary,Don't know,I haven't given it any thought too much going on right now
a8575900-7a8c-2c36-65d7-71639b2aeea6,"Republican, Donald Trump",Someone for the working class,Making America great,Worrying,Very important,Taxes
d03c9c2c-bc37-49b1-b48b-9a8c7eb3aefc,"Republican, Donald Trump",Worried about it results,Performance and results,Not sure,Very important,Not sure
7c781b98-9f32-fd3e-f358-206db49bc1ef,"Democrat, Joe Biden",Smith I got got my back and,Smith I got got a little more green,Smith and I will have to go,Somewhat important,I got to go to work
f3fac150-7429-cf81-c3a2-15ffa660604f,"Republican, Donald Trump",not a politician,illegal immigration,Determined,Very important,getting the swqnp drained
efede7bb-5909-b7d6-c353-b9e48aa2f756,"Democrat, Joe Biden",Change,Change,Good,Somewhat important,Change
fdab0afa-dbc7-945d-4994-41c5ad8f6932,"Democrat, Joe Biden",If he was black,Abortion,I feel like trump should have won,Not very important,Who was gonna win and what would change
f5d68c8f-299c-cd73-4295-f5c984d77929,"Democrat, Joe Biden",Similar Voters choices,None i wasnt really listening,Anxiety,Very important,Learning abilities
e85fda55-21c2-68f3-3cfc-7050ecb697a2,"Republican, Donald Trump",Ya I know it's hard for you lol I just wanted you guys lol,I can do that you can just send it out today and I will text you when I'm done so,Ya I know I have to go to work lol I guess I'll,Somewhat important,I can see you tomorrow if I can get you ready lol lol I guess I'm watching movie movie watching movie night lol
a72d0bf4-c84d-16c0-4021-a347a8c34b25,"Democrat, Joe Biden",Honesty and fairness,"Abortion, lbgt rights and minority rights",Uncertainty,Very important,"Abortion, lgbt rights and black and Hispanic rights"
a34321bf-7aee-e7df-5bd5-5037f7444596,"Democrat, Joe Biden",Stimulus,Stimulus,Helpless,Somewhat important,not sure
145d2f7e-f057-712b-945e-b87f0eff6a6b,"Democrat, Joe Biden",Who is willing to do the most for our country,Taking care of COVID,Excited,Not very important,maniacal is still small bowel oatmeal
0b73a040-b7e3-c615-8a5a-5d575a742a53,"Democrat, Joe Biden","Qualifications, intelligence, same ideals as me, supports the things that I support, cares about the country",Human rights were a big issue when I was deciding on who to vote for,Nervous,Very important,"Human rights, women's health, economics, clean energy"
d44260d2-5f11-6839-9203-7fc25366e938,"Democrat, Joe Biden",Not Trump,Not voting Trump in again,Don't care,Don't know,Nothing
bdf68eb0-c7e7-5797-b73c-91ca82c3892b,"Democrat, Joe Biden",For the people,Gay rights,i will hopefully remember to vote,Very important,womens rights
f525d556-bb98-abdf-71ec-02ad3db538c9,"Democrat, Joe Biden",Trustworthiness,Healthcare,Excited,Very important,Healthcare
cbbd3732-42a1-a429-9b05-0a6c235d2722,"Democrat, Joe Biden",Sorensen isomeric insolvent,Rainbow magic isomeric painting,Education,Not very important,Activism balancing anemic iconic isomeric
20a0c244-5ab7-d8b2-6c1f-b2fce77d9bec,"Democrat, Joe Biden",Liberals for public,Economic issue,I want to select a best person.,Very important,economic issue
2d3dab8a-7047-3d9d-5208-26b8611eb15c,"Republican, Donald Trump",I don't have to be a little bit of the money but I'm going back and I'm taking the church to my house,The greatest game ever I love the design and I am so addicted and love the game but the only,The answer is that I don't know how to church this morning I am going back to the answer to church,Very important,The answer to this is the church of the day and the day that you were
2b589b3f-e2a6-3e3c-3940-093a705cd91e,"Republican, Donald Trump",Anyone but Biden and Trump was most likely competitor,Biden not winning,Betrayed,I am not planning to vote in 2022,How has our country come to this. Turn on the news and look at THE PRESIDENT OF THE UNITED STATES OF AMERICA. It's pathetic
b75c3825-1c0f-b87f-eb01-bba74b814a84,"Republican, Donald Trump",Straightfowardness,The border crisis,Excited,Very important,Border crisis
230681aa-dd50-0d6b-163c-b5294357ac51,"Democrat, Joe Biden",Someone other than trump,Coronavirus response,Nervous,Very important,Economy and 15 an hour minimum wage
38f1f1ab-cb17-0945-be88-f8e4143dbd6c,"Democrat, Joe Biden",I really ant it,We love it,We appreciate it,Somewhat important,We appreciate you doing
09d1c11f-ecbb-1aac-e46b-f89a5097621a,"Democrat, Joe Biden",Someone who is not Donald trump,A president that supports the black community,Optimistic,Very important,Student loans
3ef433df-020a-5c40-a095-c0d0a26e67da,"Republican, Donald Trump",Tenacity,Immigration,Stressful,Somewhat important,Economic factor
df42eabd-604f-3c8d-961a-9968230a37e5,"Republican, Donald Trump",Their prior successes,My rights.,Worried,Somewhat important,Patriotism and the economy
3f555c7d-534d-388e-7279-ec9ef8281e0b,"Republican, Donald Trump",I just sent you a message,I did not have to,I did the wrong one,Very important,I did not get a hold on my phone and
65e92e49-b26c-8876-58fa-e8c71d10b6f6,"Republican, Donald Trump",Character,Economic issues,Motivation,Somewhat important,Immigration
accc1507-42f8-8fc5-52bc-b64dc59498c5,"Republican, Donald Trump",Integrity,Healthcare,Exciting,Very important,Voter suppression
42bd31c4-660f-dc40-6cd9-dc3f7123bc96,"Democrat, Joe Biden",I don't know,I don't know,I don't know,Somewhat important,I don't know
e028c315-928f-bbae-38a7-c67868e968cf,"Republican, Donald Trump",Less government,Keeping Americans In a position that emphasizes Republican values and truth is what we need!,I felt an honor to vote,Very important,"Our economy and our country is the most important thing for me, as it is extremely important to vote."
55525e11-b469-3821-c7ca-7ddc171acd35,"Republican, Donald Trump",The one that was willing and wanted to fix the economy,The economy,Worried,Somewhat important,Economy
8914bc96-5cb2-7033-35e0-edd684c62e4b,"Republican, Donald Trump",I'm not sure who,I don't know what it was,Stupid,Very important,Bullshit
b7c315a2-dc16-cbae-6541-35f889238eb6,"Republican, Donald Trump",Follow through,Bringing jobs to the American people,Hesitant,Somewhat important,Employment for the citizens of our country
13974770-15bd-18ba-dcaa-f6a5451ea1db,"Republican, Donald Trump",The only thing I have is that I have been,The best thing about this is that I am writing,The best way for us to be able and,Very important,Th The only reason I have been working on
198493ce-33e1-f6f7-757a-d70346281fb8,"Republican, Donald Trump",who could pull us out of this covid caused rutt,immigration,anxious,Somewhat important,Immigration issues
9381ebb3-a7f2-f07e-f821-947c43a7320c,"Democrat, Joe Biden",not being a complete idiot,anyone but trump,not involved,Not very important,climate change and abortion issues
8f962ff2-186b-6a71-1569-12ddf9cf2bd2,"Republican, Donald Trump",Ok I don't want you to have ever had,Get it done and you come home,Good night time with mama and,Somewhat important,Hey girl hope you're having
1579bc24-3ffd-f8f1-97e9-afe27d6448b2,"Republican, Donald Trump",Economic strategy,Economy,Motivated,Don't know,Economy
982e2afd-77fc-562b-9ffe-37090fa4c293,"Democrat, Joe Biden",his views on the economy,his views,sad,Very important,the green earth
a2e768d7-59b7-463f-1117-f840280d4e22,"Libertarian, Jo Jorgenson",Most personal freedoms of choice and economy fix,Economy,Essential curre the future,Very important,Economic issues especially with society's lower class
206faddb-1a31-c87e-904c-01a1434fe133,"Democrat, Joe Biden",help to the people of the usa,corona,anxious,Very important,better choice for usa
a513964e-965a-693e-85b6-9e95cc009f08,"Republican, Donald Trump","String, will get things done","Gun laws, immagration",Neutral,Don't know,Immigration
9ad28c4a-9798-739e-da78-6fcac5a06501,"Democrat, Joe Biden",caring,climate change,optimistic,Not at all important,healthcare
c61f98b1-6097-5bc0-64ab-d0358f65abf9,"Republican, Donald Trump",Someone that knew how to read,Immigration,Hopeless,Very important,I dont support life long terms
