2b5997f2-c447-ee3f-0525-c1b4f73c6a1f,"Republican, Donald Trump",Someone relatable.,Who saw the changes we needed.,Nervous,Very important,Making changes for the better.
f151ff15-a46e-e99e-ae4e-d89fd659d69f,"Democrat, Joe Biden",Someone who is responsible,Who can do more for america,Nervous,Very important,The money problems
487f70f0-e5e4-b935-53bd-99f9c5f4656a,"Republican, Donald Trump",Helping with low income families,Financial stability,Uncertain,Don't know,Nothing
2d9be542-9bc8-1ea5-e2b5-e74d38c0f0c3,"Republican, Donald Trump",Nothing. I knew it would be President Trump.,Everything was,Not shre,Very important,Nothing except hopefully its a fair election
4fa3baf6-48f3-68ba-2697-64976cfb6acc,"Democrat, Joe Biden",Someone who is reasonable,Trump is such a horrible person and deserves everything bad that ever happens to him,Nervous,Very important,Wages
1c968b9b-5d67-9515-f8c5-ef5c88f757fb,"Republican, Donald Trump",What he accomplished in the last term,Pandemic,Hopeful,Not very important,Candidates
df48d6fa-ba45-e0ff-9d51-30aed015f623,"Democrat, Joe Biden",Strong and smart,Economy,Strong one,Very important,Economy
76fab828-0c6d-5a71-6f54-d2b9747a2ecd,"Democrat, Joe Biden",Mature,Country wellness,Unsure,Somewhat important,Single parenting. Need more jobs where they can bring their child in with them
060615bf-d1b5-1519-c44f-376a4bd01f7a,"Democrat, Joe Biden","Realism,  a respect for the nation","Again, the egregious behavior of the incumbent",Conflicted,Very important,The economy
4b11c181-2dc1-2143-4469-8c048af190cb,"Republican, Donald Trump",What would help my pockets the most,The economy,Indifferent,Very important,Economy
091e11df-a2cf-c32d-4c34-f9de531b1e76,"Republican, Donald Trump",honesty,healthcare,mixed,Don't know,not sure
4d4ef3fa-bfcf-f645-a301-767aed6cbe79,"Democrat, Joe Biden",More experience on what was best. For the country,Like i said in the past question. Those 3 reason were the mayor decision,Good,Somewhat important,Im not sure yet
2f160f3d-05ba-ec78-6696-dea06c2aeb89,"Democrat, Joe Biden",Honesty,No particular reason,Hopeful,Somewhat important,Nothing in particular
1c526dd1-fdfc-4a9d-3618-187c37e2dc86,"Democrat, Joe Biden",Integrity,The character,Excited,Very important,Positive change
8cd1692d-66af-9249-fa98-f602bc059dfb,"Democrat, Joe Biden",Someone with a better view on immigrants,Stimulus check,Nervous,Somewhat important,Education and small business support
37bea260-c053-f253-5a1e-490d6894844f,"Democrat, Joe Biden",Trustworthy,Health concerns,Anxiousness,I am not planning to vote in 2022,Not voting in the 2022 midterm elections
4764a956-9968-5a3c-e684-79846b0dd81d,"Democrat, Joe Biden",Good opportunity,What he offers,No emotions,Not very important,I don't know
afd50018-e27f-7dc7-aa0b-46ea1b0b249d,"Democrat, Joe Biden",Anyone but Trump,Donald Trump had to be removed,indifferent,I am not planning to vote in 2022,unknown
282f0aa6-730f-8b28-ecaf-549ed37dcef3,"Republican, Donald Trump",Great intelligence,The economy,I'm not voting unless theirs a good candidate dis election,Very important,Economic
305a1bef-6909-03c4-6b13-b71df96846e7,"Democrat, Joe Biden",A candidate who was less agressive,"Both parties seeed aggressive, I had to vote at least one person.",Confusion,Somewhat important,Wellness for my state
80dc4873-9eb3-18ad-9c15-b25e2379750a,"Republican, Donald Trump",Proven record,Boarder security,Undecided,Somewhat important,Security
2a9d0c6a-3ffc-1e13-9c1c-ac23533487f7,"Libertarian, Jo Jorgenson",Libertarian,Must be Libertarian,Angry.,Somewhat important,"Drug legalization, save jail space for violent offenders."
05d0f23a-5ecb-b693-f3ac-2f5e1749939d,"Democrat, Joe Biden",Not incumbent,"One wants to get rid of voting, democracy and be a dictator- this is not what the US fight for",Determined,Very important,Health care
af051197-3ebb-65f1-758d-aaee760fdd95,"Democrat, Joe Biden",Reliability,Healthcare,Not sure,Somewhat important,Nothing
850f7bdc-ddf7-d263-6806-5678ad478200,"Republican, Donald Trump",The only way to get,The one that you have,The one person I can,Not very important,The one that
b197603c-a45c-7178-547c-903018dd3aea,"Democrat, Joe Biden",His over message and tone was much more positive and unifying,Environmental plans,Confident,Very important,"Healthcare reform, education, environment, student loan forgiveness in some form"
4679fe6e-9177-9972-4207-291eb3167953,"Republican, Donald Trump",Business person,Lower tax rates,Troubling,Very important,Economic issues
23d86a4f-c2e6-0c05-0926-8f85982c7129,"Republican, Donald Trump",Ethics,Economy,Uncertainty,Somewhat important,Economy
90441ec6-5ef0-195e-e152-dc3a3894de06,"Republican, Donald Trump",what they stand for and what they plan to do when in office,who going to help not hurt are country,Scared,Not very important,who will do most for the people and not be a puppet
9150d9b2-2886-825e-b741-12a5f1dde1f6,"Democrat, Joe Biden",Honesty,Environment protection,Confused,Very important,Honest candidate
278976c9-4b7d-3b08-ac5b-fe79709ad1ab,"Democrat, Joe Biden",Someone that doesn't want to dictate,Ethics,Neutral,Very important,I don't know as of right now
dbf11941-4ad6-53d0-9b81-ce242582bca6,"Democrat, Joe Biden",Pro choice,Someone that would care about the American people and with democratic views,Suspense,Don't know,Pro Choice
fab87bb6-0a4c-b231-2d6c-18d074c0bea3,"Democrat, Joe Biden",Man of honor,Trustworthiness,Responsible,Very important,Healthcare
ca3e7f3a-51a0-b33c-0d13-c33bc80aa7cf,"Democrat, Joe Biden",Stability,Morals,Nonchalant,Not very important,Healthcare
a48339f7-c703-6a4c-7150-f94fe2f2cf57,"Libertarian, Jo Jorgenson",Who aligns with my opinions,There wasn't one specific. It was all of it combined,Apathetic,Not at all important,Less government in everything.
4e2da257-8074-a1ed-4ea4-ae7336955a61,"Libertarian, Jo Jorgenson",Trump quality but in independent form,I want an independent president,Not going to,Not at all important,Voter fraud
2bf998ad-c92a-eb0c-656f-fbd8c4329e78,"Libertarian, Jo Jorgenson",Who was most FOR the working people,Helping the lower & middle class,Terrified,Very important,Helping the working people
b9f9d376-c79e-049b-6aba-8f0cc9eb6e3c,"Republican, Donald Trump",Business man,Doing what's best for our country today,Annoyed,Very important,Not sure at this tome
d59dcbfa-db32-6207-ef30-3fd078d3ca66,"Republican, Donald Trump",Brains,Economy and jobs,Mad,Very important,DO WHAT THE PEOPLE WANT
fa286316-5315-6a23-12f0-ed7dbff49c48,"Democrat, Joe Biden",someone to better our future,curruption,excited,Very important,corruptions
53ed75f6-3ec7-2cca-7031-e2cd1687819b,"Democrat, Joe Biden",Competency,Competency to be president,Excited,Very important,Healthcare
6d658f44-6928-cf38-a469-db2c1e8343bf,"Republican, Donald Trump",Sharing of most of values,Medicare/Senior issues,Apprehensive,Somewhat important,So many but...Medicare/Senior issues
28815cd9-8821-9541-1cc1-fb5ec7d4a10f,"Democrat, Joe Biden",Different,Freedom,Relief,Very important,Freedom
9341dd73-a5d8-d541-2e82-2ce612b1d17e,"Republican, Donald Trump",If he would be able to lead our country.,Leadership for our country.,Love of Country.,Very important,Protecting our southern border.  No more giant groups of immigrants.  Have a plan.
10b7de33-d627-224e-4f5a-f64ef21b7a7f,"Republican, Donald Trump",I chose the republican candidate because I don't agree with the democratic platforms,Taxes and the impact over taxing will have on business.,Hopeful,Very important,Local issues. I want people in office who respect municipalities' rights to make decisions about their own communities. Disappointed that our senate voted to take gravel mining decisions out of the hands of our local governments.
c95bc917-1c01-160c-ecc9-d15ae10b3781,"Democrat, Joe Biden",An honest individual,A person of integrity,Boo republicans,Very important,Nothing in particular
7872d73f-e389-bcaf-074b-927e54e28fa6,"Republican, Donald Trump",Dedication to the Christ,Morality in America,Great hope for victory,Very important,Drainage of the swomp
76e51a12-79c6-c757-f7fe-b7351cc6f0a0,"Democrat, Joe Biden",The huge duh huh factor.,Trump just needed to go.,Depressed,Very important,Taxes
18ad8eeb-b760-7067-ab1e-5b379d15844d,"Republican, Donald Trump",straight forward,none specific,not sure,Not very important,drain the swamp
53f42383-21b7-8e70-e647-bcfcc2886352,"Libertarian, Jo Jorgenson",Thanks for sending me,Thanks,Thanks for sending,Not very important,Thanks for sending me the info thanks
03aa96d2-2ea2-daec-fac2-84dd32a95261,"Democrat, Joe Biden",For the best interest of the people not a one sided agenda.,The point that we are Americans period.,Anxiety,Very important,The winter storm in Texas
c5a24d77-7cc3-4e98-df39-7fa5ce96cc5e,"Democrat, Joe Biden",Any Canada to think about the peoples think about the poor peoples not always the rich people that's the candidate I will vote for,The economy the peoples and many homeless people's outside that's what I think about,My thought is this vote for anyone because people were cheat people would do anything to get in the presidency house so I just pick one and go with it because you never know who to vote for because you never know who's going to was right they said I can't do this right but in the end I don't do it,Very important,The economy
b67333e0-8ceb-424f-1eca-85b31c7378e6,"Democrat, Joe Biden",Empathy,Racism,Okay,Very important,Equality
0c858238-4746-9fb7-33c3-2015dbb93bf6,"Democrat, Joe Biden",The pandemic handling,The pandemic,Excited,Very important,Gun violence
53d509af-c2b5-ac1b-4685-38bcac17cb47,"Democrat, Joe Biden",education,lower taxes,humbled,Somewhat important,improve American economy
9c2b4ca9-be2f-7685-8a8f-fb2c1ff71e8c,"Democrat, Joe Biden",Honesty and integrity is what I look for,Abortion and women television,I feel very passionately about the elections in 2022 because I need to change,Very important,Women's health issue and the
d385d453-c7ea-7fd1-ff4f-38081a9d7acc,"Republican, Donald Trump",Our economy,Our economy is good,Excited,Somewhat important,Need Republicans
1b98a0e3-9a06-8a93-0ac7-256b61f13c8c,"Republican, Donald Trump",Someone that had the charisma to build the US,economy revamp,good,Not very important,health care revamp and economy changes
e8780458-ab48-106d-6e8a-457fc712cf67,"Democrat, Joe Biden",Smart and knew what he was talking about,Healthcare and climate change,Hopeful,Very important,Healthcare
69824369-ebb1-0253-4ad2-a7ba194b3b6e,"Republican, Donald Trump",Leadership,Taxes and job economy,Confusion,Very important,Saving our country
5a357945-5813-a496-aed9-dac5d18097f4,"Democrat, Joe Biden",A democratic candadant,Immagration,The economy.,Very important,The economy.
ea072198-19ee-ad26-4e4b-36aad4249390,"Democrat, Joe Biden",His work ethic,There plan for productive progress,Strongly agree,Somewhat important,That my vote may mean winning
52e6ef74-150b-d1d8-f882-c32691f28485,"Democrat, Joe Biden",Their views toward other people,Do they support the poor,Thrilled,Somewhat important,Whether or not the candidates are fit for the job
b1f0b429-d54f-bd02-3976-c6377e9716ad,"Democrat, Joe Biden",Joe Biden,Joe buddy,Joe,Not at all important,Joe Biden
db872c8f-0551-7102-f6ef-66e43e61d359,"Republican, Donald Trump",Toughness,Being tough,Unhappy,Not very important,Doing for America
6e6aa3ec-4378-7e6b-cd3d-dee3cdad54f4,"Democrat, Joe Biden",Leadership honesty and integrity,To place a leader in the house you can leave the country.,I was excited ready to enjoy myself I was ready to vote I felt concerned about what I was doing,Very important,Issues of climate change
18bc2e3b-20f6-b8d8-9436-9f5d89cc6b08,"Republican, Donald Trump",Emotional intelligence,Economy,Enthusiastic,Very important,Proper representation
7a0430c4-58fc-8448-e555-e0870ebb51ae,"Democrat, Joe Biden",I wanted someone who didn't only think about himself,Ending the coronavirus pandemic,Indecisiveness,Very important,Immigration
1053adba-25db-78d1-b4d0-aaeade19893e,"Democrat, Joe Biden",I looked for acceptance of different people.,They are both sexual harassers.,Surprise is the emotion.,Somewhat important,The fact that it is a big diecisopn and people do t care.
82095583-e03f-7c17-cc65-037491e22c1e,"Democrat, Joe Biden",honest and integrity,education,excited,Somewhat important,education
c42c40ce-24ec-755d-683a-755ef23e9b0b,"Democrat, Joe Biden","Honesty, integrity, level geaded, experience",Not letting Trump win,apprehensive,Very important,not sure
963d4606-ae6b-19de-faec-fb4c8a240d57,"Democrat, Joe Biden",Empathy/compassion,Human rights,Nervous,Very important,Women's rights and voting rights
1812362f-c076-f92d-73a4-69a556f7e6bb,"Republican, Donald Trump",A plan that made sense to me,He was afraid,It depends on who is running and what is going on,Somewhat important,Promoting a strong economy
aee4f488-df41-c155-18d2-bfd058622bb4,"Democrat, Joe Biden",That it specifically wasnt Donald Trump,That it wasnt Donald Trump,I dont have an emotion about it yet,Very important,To vote democrat to keep them as much in majority as possible
9f40ce6a-07c4-78ba-71f2-7f0fd1a9af91,"Democrat, Joe Biden",What plans were being made to help the economy during the pandemic,Pandemic recovery,Neutral,Very important,Removing long time candidates
a7a13e62-a9db-f628-1748-ba0185147bc9,"Democrat, Joe Biden","Dedication, determination, and most of all making this a better place to live","The racism, and the mentality of our society today. We normalize things that shouldn't be normalize and we were focused on things that didn't needed to be focused on",I have mixed emotions because our candidate now haven't showed that he's any different from our last president,Very important,Racism and the amount of miscommunication we have in our country
858c5992-882c-4812-b3c3-c4289338e35d,"Democrat, Joe Biden",Not sure,Corona virus,Not sure yet,Don't know,Nothing
16d4fdff-f260-2a26-3025-f0410aa86e33,"Republican, Donald Trump",Statesmanship and intelligence,Coronavirus,Unmotivated,Somewhat important,Senior issues/climate change
6f0dc87b-dfab-24e2-af25-762cd34d09ae,"Republican, Donald Trump",Trustworthy,Cause I knew him better,I feel nothing,Very important,Trustworthiness
9ceeaf74-a3f2-a3db-9236-948e34ecb64f,"Democrat, Joe Biden",How much they want to make America a true equality country,Support of the minority communities,Not going to vote,I am not planning to vote in 2022,Helping the lower income and below poverty households get ahead and help rebuild the inner city communities
3082d7e6-e6ac-e778-d7b6-e0a34730b04b,"Republican, Donald Trump",Honest,To make the economy good again for Americans,Not sure yet,Very important,To get America back in a good state
c2d031ad-1bc6-229e-42f1-9c7b91f29ea4,"Democrat, Joe Biden",One that would bring on communism,Love baby killers,Hopeful,Very important,Fair elections
63582706-d545-b254-09bc-6a803a887bed,"Democrat, Joe Biden",High Moral Value,Morality,I am partially motivated because I feel like the Republicans are just making things worse.,Very important,Gerrymandering
067ab1d7-7059-e387-b89f-52d2a8737d14,"Democrat, Joe Biden",I dont know,I dont know,Good,Very important,Health care
1c82780f-0e84-c070-514b-30a9f6d4461c,"Democrat, Joe Biden",Honesty,Race relations,Strongly,Very important,"Social, racial and financial freedom"
c31dfb91-397a-0433-db64-8ca71ea0dd2d,"Republican, Donald Trump",What they wanted to do with the economy,Economy,Nervous,Not very important,Economy
af8422cc-484f-da28-62d4-7bffa510f7b4,"Democrat, Joe Biden",Almost the first,Knew what he was doing,Funny,Very important,Amazing funny
bb2168c4-a318-8a65-496f-e30824f7e239,"Democrat, Joe Biden","Someone who works for all people, not the party",Income inequality,"Not really great, we are getting too many strictly one way or the other candidates, not candidates for the people",Somewhat important,Income inequality
290a8303-e1c6-a7c2-41d8-93a5ffc7aba2,"Republican, Donald Trump",someone who cares about us,America first,concerned about cheating again,Very important,they put america first
75e8abfe-6af0-1106-e235-09a86bcfdfa4,"Democrat, Joe Biden",Free money,Free money,Free money,Somewhat important,Free money
2213cdad-661d-3354-aa55-e9af537574b0,"Democrat, Joe Biden",I'm not gonna go go to work today or so,None that you have been playing this game is a,None the way to my phone and I'll just need a new car and I'm,Not very important,None the way to the house and I just got a new one from my work and my moms I got a phone call my car
e798d9bf-4ce1-ca16-73cb-3b3fa6f90864,"Republican, Donald Trump",Motivation,"Taxes, gas prices, healthcare, school funding and wages",Anticipating,Very important,To get our country back
bd0c1656-de37-3877-3ee6-187277f4d7f9,"Democrat, Joe Biden",Honesty,Coronavirus,concerned,Very important,voter supression
5b5073c7-e6dc-9c76-ee7a-e3bb50340715,"Republican, Donald Trump",Ability to get things done,Economy,Confusion,Very important,Financial issues
5eb63bc5-e2f1-0e16-15c3-3faefce176a1,"Republican, Donald Trump",Strong,Economy,"Mixed, concerned",Somewhat important,Economy
9fc08086-228b-a68a-2d5f-4dd311a2c64d,"Republican, Donald Trump",Bigotry,Keeping the beans out,Carnal,Not at all important,Extreme bigotry
4ad76a0d-5219-4d62-a25c-6c5cf629c955,"Democrat, Joe Biden",Who I thought I could trust,Corona virus,Concern,Very important,Climate change
7859d906-e78f-980a-331b-c38a6173a99e,"Republican, Donald Trump",No bull shit all action man,Unemployment,We don't vote then,Somewhat important,"Firearms rights, felons if non violent should be able to have a gun to protect his family. It's not right that a felon can't have a gun in his/hers home."
60094db3-b265-293e-4531-4fd0ac01e53d,"Republican, Donald Trump",caring,safety,curious,Very important,safety
a3fe085b-81b4-1b37-698b-4ff499ff70c6,"Democrat, Joe Biden",relevant,economy,doubtful,Not very important,economy
2ba95b90-9654-a5e4-3a65-860330b6857a,"Democrat, Joe Biden",honesty,the economy,Urgency to re-again power,Very important,the economy
68e438e0-5a57-5306-b0dc-80e80aee5a68,"Democrat, Joe Biden",Personality,Had same believes as me,Excitement,Somewhat important,Things that matter to me
45590d60-265f-d5c1-78e7-e190642bb07d,"Democrat, Joe Biden",Who tells the truth.,Health Cater,I am excited and ready.,Very important,Health care.
7f5085e7-058c-dd44-32a0-2b53565a4a42,"Republican, Donald Trump",Has a lot of ideas like mine.,Jobs and the economy,Uncertain,Not very important,Economy and jobs
9b58e20a-7c8d-8aef-30a0-4e0b3a4d1f57,"Republican, Donald Trump",Being about americans,Bring america back to being america,Excited,Very important,Getting america back in line
3fc4f4d0-d1d5-0a53-d035-dd193cad3401,"Republican, Donald Trump",Honestt,Our country's welfare,Apprehensive,Very important,Economic growth
e6829d8f-9a43-fa95-7672-cdbe7dae4677,"Republican, Donald Trump",A republican that wasn't afraid of both the Democrats or should I say demon rats,Keeping America safe without all the drugs,I believe he's a very trying times with the pandemic and I would bet all that illegals in bringing more disease and God help us all,Very important,We need to secure our borders to keep the drugs up out of the schools away from children
63bb48b6-7311-71a7-1122-06a244190e59,"Democrat, Joe Biden",I look for someone who's a zombie and can I see you walking around,But as a fucking bitch was an extra two years a fucking high school hope you fucking gets a hot second one in a,My emotions are sad depressed angry,Somewhat important,President isn't she severe brain you can't sync world do you wanna say I don't she's not helping anyone
00c818ba-a210-dd25-392c-5f423f203c22,"Republican, Donald Trump",Honesty and patriotic america not sleepy Joe who does know where he is half the time,Their stance on the 2nd Amendment which shall not be infringe,It's very important but if the demoncrats pull there same stuff then all hope is lost,Very important,"A well regulated malitia being necessary to the security of a free state, the right of THE PEOPLE TO KEEP AND BEAR ARMS SHALL NOT BE INFRINGED"
ec78342e-f52d-82cc-302d-8d1fa555dfa1,"Democrat, Joe Biden",Not being too much of an idiot,Not being an idiot,Not happy,Not very important,I think it's probably the border crisis
c69aa024-7706-4602-5e5e-a4cd1426512f,"Libertarian, Jo Jorgenson",Stay out my life,Stay out my life,It's whatever,Not very important,Stay out my life
9b465e04-b4cf-dcd7-32a1-c14d46a49f8d,"Republican, Donald Trump",nothing specific,nothing specific,nothing specific,Not very important,nothing specific
2449ea0f-5e6b-1e56-7a23-53358d759038,"Republican, Donald Trump",Who could be trusted the most,Character if the person,Optimistic,Not at all important,Marijuana legalization
6001e75d-b872-c503-d4f1-211050b57397,"Democrat, Joe Biden",Nothing in specific,Biden doesn't lie like Trump does,Not sure,Not at all important,Nothing specific
2d914e29-6541-f574-52ea-13b8a575c5c7,"Democrat, Joe Biden",Built different,Built different,Built different,Very important,Built different
57f46801-69a2-e466-14c6-d16d569186b9,"Republican, Donald Trump",Foreign policy,Economy,Uncertain,Very important,Foreign policy
06339f7f-8ec4-6aab-aefb-4b37a50ee5e7,"Democrat, Joe Biden",Everything is good with you and your family and your family,Everything is good with you and your family and your family and your family and,Everything is good with you and your family,Very important,The best of the best of the best of the best of the best of
8257909d-5e3c-ff18-e1b3-9d6494e2a33d,"Democrat, Joe Biden",The past history of politics,The economy and employment,Apprehensive,Very important,Education
5fd229bc-8e67-3bc8-4401-6c6f480af459,"Republican, Donald Trump",Strong character.,Our countries financial situation.,None,Very important,Removing democrats.
419b7333-9b8c-e31b-c111-61a7339b2275,"Democrat, Joe Biden",Good leadership,Overall his views,Optimistic,Very important,Climate change
720f2288-0760-9502-739f-51c3490ec6f3,"Republican, Donald Trump",Their accommodation,Good gentleman,Exciting,Somewhat important,To pech
4da9b236-d15f-4acd-97df-c472e2fba2a1,"Democrat, Joe Biden",How likely the candidate was to piss off the world.,How devisive the country was.,Dread,Very important,Economic and social conditions
f2612977-7fe5-4edd-34d3-87dd557c9198,"Republican, Donald Trump",How level-headed they are,Quality it seems like was racist and needed more stability for United States,I don't really have any cuz I'm not going to go,I am not planning to vote in 2022,Money who's going to help me out the most
7ddee37d-ebba-ca66-2a4e-4d28c0fce144,"Democrat, Joe Biden",Responsible,Nothing specific,Nothing specific,Very important,Economic
160a56e1-1cd2-7c9f-03ac-0d1b2cb15c02,"Republican, Donald Trump",Not sure,Not sure,Not sure,I am not planning to vote in 2022,Not sure
df9f1099-0b4b-a6c4-a672-5796feef341b,"Republican, Donald Trump",who is really looking out for the people and who is lieing,Trump knows how to make something out of nothing and to take of a country,I'll vote again wonder who is going to run,Somewhat important,Not sure yet
74cd4a41-5e07-2fb2-9919-be9116a26e58,"Democrat, Joe Biden",Any one other than Trump,Getting Trump out of the WH,anxious,Very important,A person who cares about the people
5f0bb32f-e6dd-bbe3-a89a-18fe5f8e74df,"Democrat, Joe Biden",Joe Biden best,Joe Biden best,Excited,Very important,Joe Biden best
777028e6-a53d-2350-5bd1-b61cecba63b3,"Democrat, Joe Biden",Help for the middle class,Cannot remember.,Excited,Very important,Change for middle class
0af20a23-e3c6-0f79-2a0e-0060ae2a9c01,"Republican, Donald Trump",Wether he could run the country effrctivley,Trump's America first Phillosity,"We need at least a republican Senate, or house.",Very important,border security
d4fecf58-a1f8-75a4-8a4b-455957765dc6,"Republican, Donald Trump",the memory of what needs to be done,how to deal with covid-19,excited,Not at all important,how many old people are there?
b5b25ed1-af1b-5316-3a0e-681bbd5db7a4,"Republican, Donald Trump",his knowledge,his mental state,I feel misunderstood,Somewhat important,America as one
f398d16e-18b9-f0a2-a364-42e58abe5779,"Republican, Donald Trump",Not afraid to speak the truth,Economy,I'm not voting,Not very important,Not sure
793daf5a-b35c-9601-417a-f0cb07f2422d,"Republican, Donald Trump",Economics,Economics,Excited,Very important,The economic problems Americans are having now and how to resolve them
c0bf3b37-623d-c905-cc3e-b36ddc75f4cc,"Democrat, Joe Biden",Did each person stumble with words or backpedal their conversations,"Who would be more ""for the people""",Hopeful!!!,Not very important,A president that gives us more info....even better by backing up the info with effort and emotion
40d1ff56-0c78-9409-b96d-c079a75908f0,"Democrat, Joe Biden",Honesty!!,To restore decency to the office of the President again!,Optimistic,Very important,Changes in the Senate for sure!
060fc65e-9011-be99-9aee-c74ff2591fc7,"Republican, Donald Trump",Personality,Health,Unrest,Somewhat important,Not sure
520b7950-dee4-254b-0afc-13fb6e8f19bc,"Republican, Donald Trump",Who is going to stand up for us against all enemies,Economic growth,Worthlesss,Somewhat important,A better president
b1012b0f-174a-f825-564a-90627825e2f0,"Democrat, Joe Biden",charisma,economy,none,Somewhat important,econmy
3d4a49ae-e83f-6a2a-52fc-6f48e7e337c4,"Libertarian, Jo Jorgenson",Best of the worst,Social stability,Exhaustion,Somewhat important,Individual health protection
474d3a1a-695a-a2da-ad14-e5bf848622e3,"Republican, Donald Trump",That he wasn't a politician,Treating it like a business,Anxious,Very important,Gun laws
413b48c4-ef22-9e93-cfde-a771305d9749,"Republican, Donald Trump",Hard on Russia and China,Foreign Policy,Cheated,Somewhat important,No free lunch to folks that don't work
ef4bd7a8-746b-302f-7ebb-f6dfed84acc9,"Libertarian, Jo Jorgenson",Honesty and the ability to deliver on promises.,Infrastructure and job creation.,I will definitely vote and have a say in who get elected.,Very important,Making sure that everyone have a quality life and equality for all.
