1ce62a9f-79af-8348-10bb-c60d07bf63ee,"Republican, Donald Trump","Strong, knowledge, smart. tough",ILLEGAL immigration,Pissed,Very important,ILLEGAL immigration.  ILLEGALS should be removed from country. Come back. Kill them. (And stop making criminals into heros. You steal a pack of gum. You deserve to be shot in the head.)Need tough policies. Protect law biding citizens.
3e628981-9ef1-a74f-3d13-452669d75427,"Republican, Donald Trump",Who was talking to all Americans,The fall of economic growth over the last 4 years,Will definitely,Very important,Local and National economy as well as rising crime rates due to the woke crowd of defunding police
354f184e-5739-0b03-10e9-4dce6241cba3,"Democrat, Joe Biden",Selfless,He is mature and honest and selfless,Excited,Very important,Honesty
cf51a203-a2d9-99ba-c146-ed52e73bc913,"Democrat, Joe Biden","None, just that they weren't an egotistical maniac",Human Decency,Hopeful,Very important,Economy
6f689d65-61ae-3f21-67f1-c18b61fe800a,"Libertarian, Jo Jorgenson",Someone not intimidated with all the senior members of the federal government.,Economy,Nervous,Very important,Economy
147f0413-b0c4-6ddc-f634-71f87b45bd9c,"Democrat, Joe Biden",Trustworthy,Would Biden follow through with his promises,Relaxed,Very important,How Congress is doing
13ad3ead-816e-bf32-2077-5ce4151f62f9,"Democrat, Joe Biden",eagerness to help resolve the financial issues,economy,i have not thought about this as of yet,Very important,"jobs, and programs to assist with housing and back rent"
2f2bdc13-b216-5b5a-1c60-57fee5605cfb,"Democrat, Joe Biden",Honesty,Energy,Awkward,Very important,Unsure
fabb6609-7de1-7a85-11c4-194a70c98336,"Democrat, Joe Biden",Someone who cared about same things at me,Basic human rights for EVERYONE,NEUTRAL,Somewhat important,not sure
6e66a273-c4ca-00d7-8a66-de6724d4d5a3,"Democrat, Joe Biden",Nothing,Healthcare,Excited,Not very important,Nothing
1b332e43-a4b1-cf6a-9d2c-e51b37e82d71,"Republican, Donald Trump",Decision maker,Economy,Still studying  the candidates.,Somewhat important,Their ideas.
546fcba3-b336-d143-26cf-bf5144352e6f,"Democrat, Joe Biden",dedication,coronavirus vaccines,sad,I am not planning to vote in 2022,fixing the debt
c2ad0d97-75aa-ecb0-d757-ad381498d0dd,"Democrat, Joe Biden",honesty,they had to care for black people and the community,scared,Very important,community and police brutality
102f4f5c-55e3-9295-2c67-10bd97d46f61,"Republican, Donald Trump",Who stood up most for the American people,Protecting the U.S. from drug dealers and illegals,Very determined,Very important,"That whomever wins, focuses on the good for the country and Americans"
c1eecd7a-2428-185a-461d-e0171ee92d3b,"Republican, Donald Trump",Someone who thinks about the smaller people,Someone who can think for themselves,Anxious,Somewhat important,People thinking about the smaller people
24a167fd-34c6-ea9b-207c-0594b13e655f,"Democrat, Joe Biden","Honesty, empathy",Past leadership experience,Anxious,Very important,Democrat rule
fa0f01a4-87bb-1f6d-fc92-0c731e14fe04,"Democrat, Joe Biden","Intelligence, for the people",Financial help and Laws,Terrifed,Very important,Economic build up
2875ad5d-2d06-f862-8990-779cecc3b699,"Libertarian, Jo Jorgenson",honest,None in particular,weary,Don't know,not sure
95c89b2d-7892-d145-12d2-d7e6387d5add,"Democrat, Joe Biden",A person who is promising to do things I want them to fo,Cheaper healthcare,Nervous,I am not planning to vote in 2022,Cheap healthcare
81145252-c4c3-6368-bbc5-1a50787cb0d3,"Democrat, Joe Biden",cares about people and their needs,"Discrimination (racism, homophobia.",not aure,Somewhat important,racism
68181f5b-bb56-588b-b172-ec53032e2730,"Republican, Donald Trump",That they where smart organized and good at making good laws,Most of the republican candidates were to good do pick,Serious,Very important,If biden tried to stop something from what is already going on right now
ab45eaf0-7ad3-0e2a-0413-ffc7173a0c96,"Republican, Donald Trump",Ability to speak the truth,Taxes and foreign policies,Hopeful,Very important,Border policy and taxes
b432ece9-76dc-16b5-a076-aed65ed3e00e,"Democrat, Joe Biden",I just voted for everybody,Nothing because they both the same to me,Yes I was sad but I voted for joe beian,Somewhat important,Nothing really
236e9007-3468-0b6e-c609-0b78b5971e43,"Democrat, Joe Biden",record,social security,change,Somewhat important,medicare
d45e087f-86d4-aba8-805f-08927c795dd9,"Democrat, Joe Biden",experience,economy,enthusiastic,Very important,economy
f4ca6e70-74b7-99ec-48cd-42c05a66219e,"Democrat, Joe Biden",Which party they were with,Affordable health care,Indifference,Somewhat important,Affordable healthcare and education
c4605896-ef87-bf0d-c802-2f8e38de6b6e,"Democrat, Joe Biden",it has good promises and las,the economic cool,i need to kno more about the promises,Somewhat important,it is the duty to the right
82f552c8-9ae6-6149-9a69-78cf51589375,"Democrat, Joe Biden",Kindness,Immigration,Excited,Very important,Don't know
24c58b47-1609-34d1-9912-509096516ec2,"Democrat, Joe Biden",Societal ideology,Democrats back in office,Ignorant,Don't know,Minimum wage
9736bb4f-f5c8-ce3c-eee3-1d4710ecf6ae,"Republican, Donald Trump",Power and decision making,How well can the candidate improve the economy,Undecided,Somewhat important,Immigration
397a284f-76a4-c79b-bd67-34588f2d0b17,"Democrat, Joe Biden",freedoms,homeless.,very good and interesting.,Very important,homeless
1fca0f16-78f8-755f-a2f5-a68bd590f435,"Democrat, Joe Biden",Caring about the country more than himself.,Someone who wanted to make the US better.,No emotion at this time.,Very important,Healthcare
07480379-3ea7-f419-a510-af65b0167db8,"Republican, Donald Trump",No bullshit,America's economy,Depends,Not very important,America's well-being
42067d80-de4b-eb12-6fa2-2f9290c97f00,"Democrat, Joe Biden",His humble attitude,His moral character,Uncertain,Somewhat important,Voting rights
7606fa34-51d6-9f11-2569-3e130efa8993,"Republican, Donald Trump",Patriotism,There were many.,Hesitant,Very important,Not sure
6e663c0a-c1e0-a4a1-7bf8-20f6c6523c3d,"Democrat, Joe Biden",his economic politic,the economic,I am happy to vote,Very important,economic
4d38a8d0-10f5-9651-0b14-7f1f40c56cf6,"Republican, Donald Trump",Someone who sticks with their ideas and what they say they will do,Economic changes,Very confident,Very important,Progress they hadlve made in term
ec9a799e-1943-7791-b9b0-7ec4f93c8859,"Democrat, Joe Biden",Good deeds,Change,Confident,Very important,Needs
74fa65ce-489a-c27e-6281-03f01d9fff25,"Republican, Donald Trump",Not really any quality,Things he offered for small business people,No emotions,Somewhat important,Support small business people
db558642-3054-366b-6d8e-e559daf93e99,"Republican, Donald Trump",Intelligence,Finances,Stress,Somewhat important,The economy
6cb96a2c-d68e-51f0-3b9d-58321f6d5768,"Republican, Donald Trump",His policies to better America,Immigration,Excited,Somewhat important,Policies abs health care
f14152c7-a0dc-ec7d-3b17-23197f4d55b9,"Republican, Donald Trump",If he can get his job done,Taxes,Anxiety,Somewhat important,"Taxes, immigration and or health"
da55f825-5086-f384-733a-c54f62359144,"Republican, Donald Trump",honesty,social justice issues,determined,Very important,republicans losing control of the house and senate
3c10316d-3f63-a065-3e85-c8c4a9470663,"Republican, Donald Trump",CONSERTIVE VALUES,LIVED UP TO HIS CAMPAIGN PROMISES.,UPSET,Somewhat important,TAX INCREASES
58e9bbad-35b1-773c-6d56-cfd579ab3018,"Republican, Donald Trump",Which one was more stable.,Health care.,Scared,Somewhat important,Word peace
45d07382-28cb-b7ca-33b5-a667097913a0,"Libertarian, Jo Jorgenson",Honesty and loyalty,Dedication,Hesitant,Very important,"Bravery, dedication, and confidence"
abf2b369-5d0a-06d3-e592-ee7c683199c6,"Democrat, Joe Biden",Leadership,Stimulus,Anxious,Very important,Stimulus
eafd3e7b-fa5d-bd40-ed71-1fe9649a0bf9,"Democrat, Joe Biden",The way he talk to people,For education for the kids,I would like to vote I. 2022,Very important,Education is the most issue
222db2cf-bc34-3d5d-df9e-14257a7628e6,"Republican, Donald Trump",Strong honest down to business at hand,"Jobs, security, the border, business dealings",Planning to vote for sure,Very important,No specific issue
f541a44e-16cc-b813-2635-53ba4299b351,"Republican, Donald Trump","Good Values, and a strong reserve.",Security,It seems useless,Not at all important,Security
340155bd-b6ac-1c8e-3977-c7b41e56d346,"Democrat, Joe Biden",Not racist,Racism,Scared,Somewhat important,Black lives matter
21da5db1-5ef3-61c2-abd7-d3f1650ad9aa,"Democrat, Joe Biden",Likability,Donald Trump,Solemn,Don't know,Minimum wage & healthcare
e52a33e6-fec5-8a89-1db3-c0756fb9de37,"Democrat, Joe Biden",Leadership,Police,Anxious,Somewhat important,Racism and police
fb38bc6c-ae6a-7c48-48c6-a7ed06a574ec,"Republican, Donald Trump",how they would handle the economy,the economy,frustration,Somewhat important,the economy
be69ad39-0e37-8b07-cc53-5c3e52bb530d,"Republican, Donald Trump",Someone who will get the job done.,Immigration,Indifferent,I am not planning to vote in 2022,No fraud.
054046cc-16d5-0b84-661f-7117dd926cbf,"Republican, Donald Trump",what they want chsnge,what they s5and for,confused,Very important,domt kmoe
a5accd5a-48f1-8eed-6703-7089c78cd2c3,"Democrat, Joe Biden",determinación,healthcare,exited,Very important,immigration
f9285706-577c-9717-836a-58870a5a2698,"Republican, Donald Trump",The candidate with views as in line with Christianity as possible.,Education,Lethargic,Somewhat important,Our state's education and spending
bd9277a4-1d2a-e042-042a-2f6480e1be4d,"Republican, Donald Trump",How he ran the country the last 4 years,The boarder  wall,Confused,Very important,All of them
5761b099-43db-ea42-cece-36ae9fb209b1,"Democrat, Joe Biden",anyone not donald trump,healthcare,nervous,Not very important,my vote ddon't matter
be86f5d0-f73e-eb07-a860-25bfde68666d,"Republican, Donald Trump",Country,Bullshit,Bullshit,Very important,Bullshit
4d844cb6-7c99-d86e-b9d5-546c9a154b85,"Republican, Donald Trump",republican candidate,Stimulus package,optimistic,Very important,republican party
160a3a13-30df-c50c-89e0-8b89ca3e3238,"Republican, Donald Trump",What he wanted to do for america,his love for America,anxious,Very important,Employment. Taxes
ef6e9295-9c8a-f485-b980-50a6974e598d,"Democrat, Joe Biden",Conservative,Build America up,Good,Somewhat important,Abortion
6ab76840-f5b5-ac71-63ef-5e69b61d56f5,"Democrat, Joe Biden",Loyalty,Stimulus check,Confused,Very important,Climate change
a70a409d-ac50-c260-f0f2-4933d544c79b,"Democrat, Joe Biden",Not a scumbag,Biden not a scumbag,Apathy,Not at all important,Don't care
7b9ea9eb-aac4-363f-1610-ac0abfcf214e,"Democrat, Joe Biden",Don't know,Education,Don't know,Very important,Don't know
cb21aa80-19d4-d39a-7dff-e27d9b125dfb,"Republican, Donald Trump",religious background,The economy and Jobs,I am hoping there are better canidates,Very important,midterm elections need new people
8fde042a-1ee5-6930-3a08-5f6a9e189a98,"Republican, Donald Trump",Nothing,Nothing,Nothing,Not very important,Nothing
c81a5f0f-1b1b-ba94-f983-4d4b1c65f6bd,"Democrat, Joe Biden",Human rights,Gay rights,Indifferent,I am not planning to vote in 2022,Gay rights
f83a1bce-7069-6977-33af-15bed93d8722,"Republican, Donald Trump",Compassion,The coronavirus.,Determined,Very important,The economy
8422c0cf-da36-433a-f3ab-d2467570d730,"Democrat, Joe Biden",experienced,ability to govern,non interest,Don't know,nothing comes to mind?
c680a2e5-678d-af97-a614-f06ac81484cd,"Democrat, Joe Biden",I was looking for an experienced politician who could get things done quickly and couldn't keep his ego out of the equation,COVID-19 issues,Frustrated,Very important,The main issue is foreign policy with our competitors like China and Russia and our relationship with both of them
e13f8740-bd74-0fe0-b808-8e14b9a01137,"Republican, Donald Trump",to help us all,jobs and the economy,I will probably vote,Somewhat important,jobs and security for the American people
8a39068b-cbed-e473-e3eb-f7c10723e11e,"Republican, Donald Trump",Who has more leadership abilities,Economy,Indifferent,Somewhat important,Economy
13fc927f-7237-cf5b-36fc-1c4679ebb8bb,"Democrat, Joe Biden",The most likely to win over Trump,That trump would lose,🙃😒🙄😏🤨🥵🤮,I am not planning to vote in 2022,A new election process that is not a popularity contest based on wealthy people who can raise money to support a campaign.
752caa97-b60d-f6a3-7c19-8515208b326a,"Republican, Donald Trump",Nothing,I don't politic,Nothing,Not very important,Nothing
83601fb5-b45b-bad3-f7d0-eea0211f632b,"Democrat, Joe Biden","I looked for Dedication, Sympathy, and REAL President",The most important issue that I had when voting was rather I'm making the wrong decision or am I doing the right thing. Like will the world really change for the better,The best emotions to describe voting in year 2022 is demanding in rather the world change for the better,Very important,No changes
bd5a6112-d1b2-2e3c-2ede-2487373058be,"Republican, Donald Trump",Trustworthy,Financials,Okay,Somewhat important,Trustworthy
80acefb5-79d0-5e2b-c024-9b51307c3f63,"Democrat, Joe Biden",Fairness and equality,One nation under God and equality for all,Sundued,Very important,Equality and better economic conditions
4c4b52aa-0ef9-f903-b69a-deac06f4b0ee,"Democrat, Joe Biden",Changing for the better of the people,Economy,Anxiety,Very important,Racism
3d57ee27-33da-efc1-0d47-e26d1ef7a52e,"Democrat, Joe Biden",puts the peoples opinions first,Healthcare and ending the pandemic,excited for new beginnings,Very important,healthcare and economic growth
8dd7e052-44e7-a702-04c4-7757e2db1ce3,"Democrat, Joe Biden",No comment,No comment,No comment,Somewhat important,No comment
19fc8579-acd3-2f62-960f-69fcf6a646ee,"Democrat, Joe Biden",Safety,Job Security,Nervous,Very important,Infrastructure
a98afcb0-3ef5-27fe-45e4-307a73e5550d,"Republican, Donald Trump","Doing what they said they'd do, not blow smoke up my a$$",Border & the truth,Nervous,Very important,"Freedoms, national security"
35eb728f-5775-0d0f-5256-e276fba75385,"Republican, Donald Trump",Whether they were going to hurt or help the economy and our country,Which one was truly trying to help our country,Anxious,Somewhat important,The economic issues that effect my children's future
fae91634-3bf8-5406-389d-2267b7c25d94,"Republican, Donald Trump",The quality of Leadership,american Security,anxious,Very important,Keeping the filibuster
096b7724-5ced-83b3-f7a0-be7a7e6a3ea7,"Republican, Donald Trump",Compassion,Care for the country,Indifferent,Very important,Republican seats
bd22f7fc-a8eb-2ba6-319a-ed6a8d41cb4c,"Republican, Donald Trump",Moralissi,Moralissies,Excitement,Very important,The economy and how we treat everyone
f845846e-fdf0-861e-05eb-074dad900360,"Republican, Donald Trump",Brave enough to challenge the establishment,The good of the country; capitalism,So-so,Not very important,Not crippling this country and handing it over to China and other world powers
eb1bb47f-4726-9e7f-0c05-e009397bfdd7,"Republican, Donald Trump",Similar ideas,All important,Invisible,Not at all important,All important
50f53bd8-72e8-9652-884c-0a556b893000,"Republican, Donald Trump",Honesty,Immigration,Frustrated,Very important,Abortion
0d5d2f64-8f2b-892b-0e48-4034ad74dd43,"Republican, Donald Trump",Business acccumen,Economy,Curious,Very important,Economy
7412c272-02b7-1c51-9fbe-ffb3a8e3ac9b,"Democrat, Joe Biden",None of a above,None of a above,None of a above,Don't know,None of a above
b1420898-998a-05a8-77a7-aed0fb5f5290,"Libertarian, Jo Jorgenson",Has a sound state of minds and care more about the poor and middle class and not the rich,Health care,I am not worrying about that right now,Not very important,Education and health care
1ad74fd4-298b-2e78-5420-60ce6b2f9d47,"Democrat, Joe Biden",personality,new laws,nervous,Somewhat important,health care
5b9e75f4-12e0-0b9c-0288-49d95ce195be,"Democrat, Joe Biden",Gut feeling,Overall good intentions,Nervous,Very important,War and change in climate
247474b3-1d7d-0bb3-8e00-44e207af3b8a,"Republican, Donald Trump",Leader,Terrorism and BLM,Disgusted,Not at all important,Immigration
5c230306-c3f9-f409-e9a7-480095ef8b1b,"Republican, Donald Trump",All around strength,Economy,Defeated,I am not planning to vote in 2022,Getting rid of Biden
19e79a3d-e920-4a24-4304-93f0d7c713b7,"Democrat, Joe Biden",respect for population,what they stood for and promised,uneasy,Very important,unemployment issues
23226464-ad6d-84ef-d4d9-a0ae055fd8d1,"Democrat, Joe Biden","How real his words seemed. Was he speaking like a real person, rather than a politician.",What his plan to assist in the pandemic,Bewildered,Somewhat important,Nothing comes to mind.
a1243bea-0da2-6154-3f46-a43a53e2e047,"Democrat, Joe Biden",Who would make us more effective,Education,we just have to see what joe has in store,Very important,Rights of African americans
ba303cce-3590-97e0-7d2e-7d9ee2c6093e,"Republican, Donald Trump",God-fearing,morals,republicans need to unite,Somewhat important,who the president of usa is in 2022
5fcfe711-8258-3678-c04a-7761a52368e3,"Republican, Donald Trump",RESOLUTENESS,CRIME RATE AND NATIONAL SECURITY,INDIFERENCE,Somewhat important,OUR RIGHT BEAR ARMS. POLICE FUNDING
94c8a69d-44b1-a1ee-7948-36f27eaab0a1,"Republican, Donald Trump",Same views as I have.,Morals,Don't have any,Somewhat important,Rights
46c3c90c-c92e-fe01-1402-3a93a4c688ec,"Republican, Donald Trump",Truthfulness,Immigration,Hopefully,Somewhat important,Immigration
641e7f8c-4c25-998e-cad7-3d36b62e8f02,"Democrat, Joe Biden",Political views,The pandemic,Looking forward to it,Very important,Political views
2df8d4a8-3fc7-4cb8-6a40-e5cc2cd51392,"Republican, Donald Trump",strong American,strong leader,nervous,Somewhat important,the times
286e3f0a-dedb-aec4-e2b2-de4b3d5cab0e,"Republican, Donald Trump",their agenda,economy and border,hopeful,Somewhat important,economy
89a92af3-a0ca-0f8e-e1ef-2dd3461633bc,"Democrat, Joe Biden",To not support false information like Trump,To remove Trump,Haven't thought about it,Very important,"Require background checks on guns no one needs assault rifles, more climate restrictions, solar panels on White House roof? Loads"
11162039-ea92-659b-aaaa-077f4ab946a2,"Republican, Donald Trump",How they reason with issues,The safest country we could have and the job opportunities,Very excited,Somewhat important,The cost of gas and everything going up way to much
761b7e11-7c19-2e61-76d8-cbc7bfa93b6e,"Republican, Donald Trump",Leadership and transparency. Biden lacks these,Biden panders and lies multiple times. His stance on issues were never clear.,Indifferent,Somewhat important,Not a specific issue.
1a50a93c-e5a2-709d-a8f8-687bb766ac85,"Democrat, Joe Biden",Very fun,Yes,Very good,Very important,Very happy
52c83bfc-5b48-961f-1b1b-4cd736ba4918,"Democrat, Joe Biden",Likability,Abortion rights,Won't do it,Not at all important,Abortion rights
ca90001c-8943-314f-b668-705d1a10748c,"Republican, Donald Trump",strength,honesty,no emotion,Somewhat important,getting republican elected
e97f995d-9bc8-d6f6-0484-a1b355c974a4,"Democrat, Joe Biden",Honestly and true desire to help the American people and environment,Global climate change and being involved in the fight against it,Excited,Somewhat important,Climate change and civil rights issues
03671560-fd06-875b-b462-931f966456be,"Democrat, Joe Biden",Self respect and dignity,Environment,Nonchalant,Not very important,Environment
3e59034b-c1da-db7d-6db2-094bbce7e298,"Democrat, Joe Biden",Oh ya gotta I love,I pinky promise I pinky,Yeah that's true I don't want,Somewhat important,Oh ya gotta I
57bd0ca8-54ce-20ea-bb9d-92c0d8d0b8db,"Republican, Donald Trump",Honesty,Everything that Mr. Trump did and wanted to do was exceedingly awesome.,We need that idiot out,Very important,Everything that Mr Trump was set to do
fd063a58-aa3d-d585-eaec-f4e0e81909ce,"Democrat, Joe Biden",Mental competency and ability to see the whole picture regardless of party lines.,Moral and mental stability.,Apathy.,Very important,Economy and jobs.
2efcd60c-5256-cd59-857f-2f3e61a90fb1,"Democrat, Joe Biden",Joe biden,I didn't vote I was in prison at the time.,Not sure,Very important,Not sure
f42323d9-11ea-8815-7ddc-44f5deaf9631,"Democrat, Joe Biden",for me it's very important,nothing it was about a good,it is a great,Somewhat important,it is a great branded
fdf48930-a265-df65-0d56-e00031456a6c,"Republican, Donald Trump",Bold,Economic issues,Not excited at all,I am not planning to vote in 2022,None anymore
f42973f5-d1d1-8e0b-27e7-a6bdc2a49fd8,"Republican, Donald Trump",Economic,Immigration,Redemption,Somewhat important,Immigration
61652fd3-41dd-dedf-2cfa-a174ba059e68,"Democrat, Joe Biden",Honesty,Getting the country back to normal.,Important,Very important,"Getting people back to work, health care for the elderly,"
123c6a29-969b-6b4b-fcce-3ef8a41bc4c2,"Democrat, Joe Biden",I wanted someone with ethics.,Reuniting the country and improving our image to the world.,I have anxiety.,Very important,Promoting Democratic policies.
25dbbe8d-a534-9425-aa69-b7f7b28d7cb8,"Democrat, Joe Biden",Not named trump,Trump was running,Scared,Very important,Voting rights
6d4772f8-d46a-77af-2a73-6a676c461d48,"Democrat, Joe Biden",compency,immagration and the pandemic,hopeful,Somewhat important,taxes and employment
e2fb8d66-a892-8ad4-887f-e19cf7ba19f9,"Republican, Donald Trump",His strong stance with other nations,he boarder,It is something I am eagerly awaiting to do,Very important,The economy
6ab62dbf-8663-e8bb-6af7-895bb241cfd3,"Republican, Donald Trump",Leadership,Economic issues,Nauseous,Somewhat important,Economic issies.
1c3892e8-f2cf-cd63-80ab-4b7f2e968660,"Democrat, Joe Biden",No I need a ride,I need new presidensts,Sad happy mad,Not very important,Weird stuff
a2ed50b9-de4c-f8bc-1bf4-3b9f9fda15ac,"Democrat, Joe Biden",cares about people,environment,feeling nervous,Very important,truth from candidates
15f0e5ea-4b0a-4742-146e-6a4f2a873e02,"Democrat, Joe Biden",Best for country,No issues at all,Very important,Very important,No issues
56282768-6df0-ac3c-9ab8-180f56479889,"Republican, Donald Trump",Helping the economy,The economy,Concerned,Very important,The economy
0692fe02-238c-8712-eccf-3b91e35209a0,"Republican, Donald Trump",most trustworthy,economy,indifferent,Not very important,economy
bc5e3e2f-cebc-1bd7-f837-8be20bb68d75,"Democrat, Joe Biden",Someone who runs with fairness,if he really wants the best for this country,very scared,Somewhat important,Imagration
a23036d2-88d7-d47c-ec38-704b22c0eee9,"Democrat, Joe Biden",someoje who would get covid under control,covid,nervous,Somewhat important,women's reproductive rights
ec814510-c42e-afc8-9372-e80dee892190,"Republican, Donald Trump",Resilience,Climate issues,Tired,Somewhat important,"Climate issues; rights to women, LGBTQ people, and people of color"
57dda51e-a4dc-4d4e-108e-04ac99c6207f,"Democrat, Joe Biden",There plans.,Who was doing what is best for America,I feel confident,Somewhat important,Health insurance and cOVId
302b0401-efed-098b-979a-7368bd96bb0a,"Democrat, Joe Biden",Attitude,Covid plan,Hopeful,Very important,Economy
92a593c8-1db9-2330-f127-6a5cbe9f44cb,"Republican, Donald Trump",honesty,budget and security,uncertain,Very important,security and police issues
d0ef1299-250b-1c5a-50e0-8a8175ea1023,"Republican, Donald Trump",I like Trump,Trump is not a politician,nothing,Somewhat important,senior issues
d3e78237-cd21-74d3-d960-6af0aa546c79,"Republican, Donald Trump",It was good,It was good,It was good,Not at all important,It was good
4a9f6c5c-7eb9-fe2d-3738-7270d424d9f3,"Democrat, Joe Biden",Helping all immigrants,Immigration,nervous,Very important,immigration
0f0e5767-606f-fa15-f76c-432eb4428cde,"Democrat, Joe Biden",Honestly,Integrity,Sad,Somewhat important,The environment
dbc21e42-fd0d-4cb1-c916-7a93ada63c4b,"Democrat, Joe Biden",Someone who respects both genders,Trump's misogyny,Expectant,Somewhat important,Not sure
c69e17c9-6018-5b17-bec5-715ca71db3a6,"Republican, Donald Trump",Orange orange juice,Pls fix it,I have a mental problem,Not at all important,Pls rob a river in my own home and the other side is moon
a43366c9-7d3d-6b72-1f3e-c5721527b2ac,"Democrat, Joe Biden",I'm not sure,I'm not sure,I'm not sure,Very important,I'm not sure
fcc2ed18-92ae-f13c-963b-d56405e514ff,"Democrat, Joe Biden",I wanted to vote for a candidate that could lead the country with dignity and compassion,Getting rid of Donald trump,Nervous,Very important,Keeping control of the house and senate but i am not hopeful
fffcff63-7bf3-f8f5-624b-31d72e5c58ad,"Democrat, Joe Biden",honesty,The need to do something about climate change and its effect on the world,unsure,Don't know,economy
105dd35c-7d12-7b6b-87b3-d329cfec1804,"Republican, Donald Trump",Taking down the bad guys,Taking down the bad guys,Nothing wrong nothing nothing about nothing,Somewhat important,Nothing wrong nothing nothing wrong nothing nothing about
89fab5cc-95b0-4f8a-d64f-10b584d6b400,"Libertarian, Jo Jorgenson",brains,government spending,nonchalant,Somewhat important,vaccine passport legislation
41bb0e0d-8fff-c06d-167b-6ea029451370,"Democrat, Joe Biden",Engagement with voters,Economy,Confident,Very important,Economy
4c6f9a45-8192-ef8f-1fed-7603fadc9704,"Republican, Donald Trump",Cares about the people,Our economy and taxes,Nervous,Very important,Previous answer
7d8da92b-93ba-f4a3-23cd-8a4471e64bce,"Republican, Donald Trump",Helping the American e,Stimulus money,Won't make a difference,Don't know,I'm not sure
e92915a3-85cd-74bf-501c-93a3b1f22be5,"Democrat, Joe Biden",environmental concerns,voting trump out,unsure,Somewhat important,environmental
f0b0e729-6ce3-4d67-ad30-c94b4111e681,"Democrat, Joe Biden",Handedness,Change,Obligated,Somewhat important,"Freedom, love"
a54427ec-b261-ad5c-a214-245cfecfdd72,"Republican, Donald Trump",Support of law enforcement,Right to bear arms,Dont know,Somewhat important,Dont know
